{
  "schema_version": "1.0.0",
  "release_id": "00000000-0000-0000-0000-000000000000",
  "timestamp_utc": "2026-09-09T00:00:00Z",
  "git": {
    "repo": "https://github.com/cryptyroot-ux/polyroot-agent",
    "branch": "main",
    "commit_sha": "0000000000000000000000000000000000000000",
    "tag": "v0.1.0-foundation",
    "dirty": false
  },
  "upstream": {
    "repo": "https://github.com/alsk1992/CloddsBot",
    "commit_sha": "715fd4a6c06b4cd5bb38eee225dd09b3bc95c5e8",
    "version": "1.9.0",
    "license": "MIT"
  },
  "runtime": {
    "node_version": "24.18.0",
    "node_engine_range": ">=24.0.0",
    "npm_version": "11.16.0",
    "lockfile_sha256": "0000000000000000000000000000000000000000000000000000000000000000"
  },
  "dependencies": {
    "@polymarket/client": "TBD-pinned-at-G0",
    "zod": "^3.22.4"
  },
  "image": {
    "repository": "polyroot/trader",
    "tag": "dev",
    "digest": "sha256:0000000000000000000000000000000000000000000000000000000000000000"
  },
  "sdk": {
    "package": "@polymarket/client",
    "version": "TBD-pinned-at-G0-after-contract-checks"
  },
  "contracts": {
    "chain_id": 137,
    "registry_version": "v0-bootstrap"
  },
  "schema_migrations": {
    "schema_version": "1.0.0",
    "migrations": [
      "0001_initial_schema.sql",
      "0002_pm_domain.sql",
      "0003_v11_charter_assets_graph_permits.sql"
    ]
  },
  "strategies": {},
  "policy": {
    "policy_version": "v0-bootstrap",
    "policy_hash": "TBD-computed-at-commissioning"
  },
  "gate_reports": [],
  "fork_disposition": "docs/ARTEFAK/fork_disposition.csv (TBD — required before G1)",
  "sbom": {
    "format": "spdx-json",
    "sha256": "0000000000000000000000000000000000000000000000000000000000000000"
  }
}
