{
  "schema_version": "1.0.0",
  "release_id": "55b45854-9165-defc-4d18-b431dae7ea4e",
  "timestamp_utc": "2026-10-02T07:06:42.393Z",
  "git": {
    "repo": "https://github.com/cryptyroot-ux/polyroot-agent.git",
    "branch": "main",
    "commit_sha": "55b458549165defc4d18b431dae7ea4ecc3584ff",
    "tag": "v1.14.2",
    "dirty": false
  },
  "upstream": {
    "repo": "https://github.com/alsk1992/CloddsBot",
    "commit_sha": "715fd4a6c06b4cd5bb38eee225dd09b3bc95c5e8",
    "version": "1.9.0",
    "license": "MIT"
  },
  "runtime": {
    "node_version": "24.18.0",
    "node_engine_range": ">=24.0.0",
    "npm_version": "11.16.0",
    "lockfile_sha256": "3a3dfcd43d75d16885ce6e38888db94cfa88499d8444ef16cdc14eacf7f879a5"
  },
  "dependencies": {
    "@polymarket/client": "0.9.0",
    "zod": "^3.22.4"
  },
  "image": {
    "repository": "polyroot/trader",
    "tag": "v1.14.2",
    "digest": "sha256:08964ec67a3bd889d8198b038f5779fcbc33ce7be3f526f6043b56930567477e"
  },
  "sdk": {
    "package": "@polymarket/client",
    "version": "0.9.0"
  },
  "contracts": {
    "chain_id": 137,
    "registry_version": "v0-bootstrap"
  },
  "schema_migrations": {
    "schema_version": "1.0.0",
    "migrations": [
      "0001_initial_schema.sql",
      "0002_pm_domain.sql",
      "0003_v11_charter_assets_graph_permits.sql",
      "0004_mandate_rename_constraints.sql",
      "0005_balance_store_event_sink_recovery_supervisor.sql",
      "0006_paper_shadow_runtime.sql",
      "0007_permit_order_binding.sql",
      "0008_permit_payload_hash.sql",
      "0009_recovery_ledger_fix.sql",
      "0010_durable_reservations.sql",
      "0011_kernel_events_decision_id.sql",
      "0012_reservations_active_intent_unique.sql",
      "0013_reservation_lifecycle_accounting.sql",
      "0014_risk_decision_extra_fields.sql",
      "0015_live_guard.sql",
      "0016_market_event_graph.sql",
      "0017_source_records.sql",
      "0018_catalyst_bus.sql",
      "0019_calibration_ensemble.sql",
      "0020_research_budget.sql",
      "0021_shadow_g5_infrastructure.sql",
      "0022_seen_orders.sql",
      "0023_runtime_mode_hot_reload.sql",
      "0024_arb_observations.sql",
      "0025_telegram.sql",
      "0026_recovery_fill_tracking.sql",
      "0027_live_promotions.sql"
    ]
  },
  "strategies": {},
  "policy": {
    "policy_version": "v0-bootstrap",
    "policy_hash": "TBD-computed-at-commissioning"
  },
  "gate_reports": [],
  "fork_disposition": "docs/ARTEFAK/fork_disposition.csv (TBD — required before G1)",
  "sbom": {
    "format": "spdx-json",
    "sha256": "4240151d306fc7187d8b47264b147b87ba34be5b4dbf3af9884cc8a5bda8681d"
  }
}